{
  "id": "pr-b82534ec-3aaa-4814-976a-b3ace005b4f0",
  "agentId": "copilot-agent",
  "type": "pr",
  "title": "PoC: agent proposed change",
  "description": "Squelette de PR propos√© par Copilot agent",
  "files": [
    {
      "path": "README.md",
      "change": "append",
      "content": "Agent PoC"
    }
  ],
  "timestamp": "2025-10-25T19:13:35.171Z"
}