{
  "id": "pr-837c0406-c01b-46f5-b0d5-312114564560",
  "agentId": "copilot-agent",
  "type": "pr",
  "title": "PoC: agent proposed change",
  "description": "Squelette de PR propos√© par Copilot agent",
  "files": [
    {
      "path": "README.md",
      "change": "append",
      "content": "Agent PoC"
    }
  ],
  "timestamp": "2025-10-25T18:53:59.146Z"
}